"Simple Interest vs. Compound Interest																										
Nominal Interest Rate vs. Effective Annual",373
"Interest Rate ............																														
Present Value of a Single Cash Flow To Be Received",374
in the Future ....,374
Future Value of a Single Investment,375
"The Importance of Cash Flow Diagrams																							
Analyzing and Valuing Investments/Projects with",375
Multiple or Irregular Cash Flows,375
Perpetuities,376
Future Value of a Periodic Series of Investments,377
"Annuities, Loans, and Leases ..... ...																													
Gradients (Payouts/Payments with Constant",377
Growth Rates),378
